{"$schema":"https://json-schema.org/draft/2020-12/schema","additionalProperties":false,"properties":{"candidate_ref":{},"character_ref":{},"color_space":{},"crop":{},"expression":{},"facing":{},"format":{},"has_alpha":{},"height":{},"id":{"pattern":"^[a-z0-9]+(?:-[a-z0-9]+)*$","type":"string"},"kind":{"const":"export-manifest"},"license_status":{},"path":{},"pose":{},"review_ref":{},"schema_version":{"const":"1.0"},"sha256":{},"sidecar_path":{},"status":{},"version":{},"width":{}},"required":["kind","schema_version","id","character_ref","candidate_ref","review_ref","path","sidecar_path","sha256","width","height","color_space","has_alpha","format","license_status","status","crop","facing","pose","expression","version"],"title":"export-manifest","type":"object"}
